{
  "$schema":"https://json-schema.org/draft/2020-12/schema","$id":"https://heaotang.cn/contracts/modules/health-manager/mvp90-m1/professional-boundaries.v1.schema.json",
  "$defs":{"actionId":{"enum":["DATA_ORGANIZATION","ASSESSMENT_DRAFT","GOAL_PLAN_DRAFT","PLAN_REVIEW_ACTIVATION","TASK_EXPLANATION","FEEDBACK_RECORDING","PLAN_ADJUSTMENT","GROWTH_RECORDING","RISK_IDENTIFICATION","RISK_CLOSURE","EMERGENCY_RESPONSE","DIAGNOSIS","PRESCRIPTION","TREATMENT_ADVICE","REFERRAL","PROFESSIONAL_REVIEW","SAFE_RESUME_AUTHORIZATION"]},"decision":{"enum":["allow","deny","draft-only","review-required","transfer-only"]}},
  "type":"object","additionalProperties":false,"required":["contract_version","module_id","scope","source_decision","source_version","decision_status","executable","boundaries","global_forbidden_outcomes","review_triggers"],
  "properties":{"contract_version":{"const":"health-manager.mvp90-m1.professional-boundaries.v1"},"module_id":{"const":"health-manager"},"scope":{"const":"HM-MVP90-M1 adult synthetic-member PDCAR only"},"source_decision":{"const":"contracts/modules/health-manager/mvp90-m1/readiness/c4-h01-action-boundary-decision.v1.json"},"source_version":{"const":"v1-proposed"},"decision_status":{"const":"Accepted"},"executable":{"const":false},
    "boundaries":{"type":"array","minItems":17,"maxItems":17,"items":{"type":"object","additionalProperties":false,"required":["action_id","ai","health_manager","professional","fail_closed","transfer_owner","source_pointer"],"properties":{"action_id":{"$ref":"#/$defs/actionId"},"ai":{"$ref":"#/$defs/decision"},"health_manager":{"$ref":"#/$defs/decision"},"professional":{"$ref":"#/$defs/decision"},"fail_closed":{"type":"string","minLength":1},"transfer_owner":{"type":"string","minLength":1},"source_pointer":{"type":"string","pattern":"^#/actions/(?:[0-9]|1[0-6])$"}}},"allOf":[
      {"contains":{"properties":{"action_id":{"const":"DATA_ORGANIZATION"}},"required":["action_id"]},"minContains":1,"maxContains":1},{"contains":{"properties":{"action_id":{"const":"ASSESSMENT_DRAFT"}},"required":["action_id"]},"minContains":1,"maxContains":1},{"contains":{"properties":{"action_id":{"const":"GOAL_PLAN_DRAFT"}},"required":["action_id"]},"minContains":1,"maxContains":1},{"contains":{"properties":{"action_id":{"const":"PLAN_REVIEW_ACTIVATION"}},"required":["action_id"]},"minContains":1,"maxContains":1},{"contains":{"properties":{"action_id":{"const":"TASK_EXPLANATION"}},"required":["action_id"]},"minContains":1,"maxContains":1},{"contains":{"properties":{"action_id":{"const":"FEEDBACK_RECORDING"}},"required":["action_id"]},"minContains":1,"maxContains":1},{"contains":{"properties":{"action_id":{"const":"PLAN_ADJUSTMENT"}},"required":["action_id"]},"minContains":1,"maxContains":1},{"contains":{"properties":{"action_id":{"const":"GROWTH_RECORDING"}},"required":["action_id"]},"minContains":1,"maxContains":1},{"contains":{"properties":{"action_id":{"const":"RISK_IDENTIFICATION"}},"required":["action_id"]},"minContains":1,"maxContains":1},{"contains":{"properties":{"action_id":{"const":"RISK_CLOSURE"}},"required":["action_id"]},"minContains":1,"maxContains":1},{"contains":{"properties":{"action_id":{"const":"EMERGENCY_RESPONSE"}},"required":["action_id"]},"minContains":1,"maxContains":1},{"contains":{"properties":{"action_id":{"const":"DIAGNOSIS"}},"required":["action_id"]},"minContains":1,"maxContains":1},{"contains":{"properties":{"action_id":{"const":"PRESCRIPTION"}},"required":["action_id"]},"minContains":1,"maxContains":1},{"contains":{"properties":{"action_id":{"const":"TREATMENT_ADVICE"}},"required":["action_id"]},"minContains":1,"maxContains":1},{"contains":{"properties":{"action_id":{"const":"REFERRAL"}},"required":["action_id"]},"minContains":1,"maxContains":1},{"contains":{"properties":{"action_id":{"const":"PROFESSIONAL_REVIEW"}},"required":["action_id"]},"minContains":1,"maxContains":1},{"contains":{"properties":{"action_id":{"const":"SAFE_RESUME_AUTHORIZATION"}},"required":["action_id"]},"minContains":1,"maxContains":1}]},
    "global_forbidden_outcomes":{"type":"array","minItems":5,"uniqueItems":true,"items":{"type":"string","minLength":1}},"review_triggers":{"type":"array","minItems":5,"uniqueItems":true,"items":{"type":"string","minLength":1}}
  }
}
